id,name,phones,address,website,emails,city,region,segment,crm_score,is_network,cms,has_marquiz,telegram,vk,whatsapp
8424,Постамент. ру,74952013227; 79262668877; 74951322272; 79660990708; 79100847144; 79672013223; 79261303227; 79262133227,"ул. Корешкова, 02, Электросталь, Электросталь",https://postament.ru/,info@postament.ru; info@postament.ru>,Электросталь,,A,66,Yes,bitrix,No,https://t.me/PostamentBot,https://vk.com/postamentu,https://api.whatsapp.com/send?phone=79997728751
8423,Возрождение,74957402646; 79256027181; 70281001000,"Московская область, Электросталь, Загородный проезд, Электросталь",https://vozrogdenie1.ru/,infoGAVvozrogdenie1DDOTru; info@vozrogdenie1.ru,Электросталь,,A,50,Yes,unknown,No,https://t.me/+74957402646,https://vk.com/vozrogdenie1granit,https://api.whatsapp.com/send?phone=79256027181
8422,Union stone,79687933956; 79684461379,"Московская область, Богородский городской округ, деревня Тимохово, Богородское кладбище, Электросталь",https://union-stone.ru/,info@union-stone.ru,Электросталь,,A,48,No,wordpress,No,https://t.me/79684461379,,https://api.whatsapp.com/send?phone=79684461379
8421,Гранитная мастерская,79163891718; 79258049499; 79104511969; 79260887823; 79263358845; 74965166591; 79264745240; 79297459797; 79271718970,"Московская область, Электросталь, Загородный проезд, Электросталь",http://pamyati.ru/,,Электросталь,,A,45,Yes,unknown,No,https://t.me/+79163891718,,https://api.whatsapp.com/send?phone=79163891718
8434,Памятники. Moscow,79268252866; 74953694359; 79057057777,"Россия, Московская область, Богородский городской округ, Богородское кладбище, Электросталь",https://pamyatniki.moscow/,info@pamyatniki.moscow,Электросталь,,A,40,Yes,opencart,No,https://t.me/+79268252866,,
