id,name,phones,address,website,emails,city,region,segment,crm_score,is_network,cms,has_marquiz,telegram,vk,whatsapp
1887,Гранитная мастерская,79201745741; 79109333675; 79201566909; 79108357466,"Тверская область, Вышневолоцкий городской округ, Новое городское кладбище, Вышний Волочёк",http://волочек-гранит.рф/,,Вышний Волочёк,,A,43,No,wordpress,No,https://t.me/+79201745741,,https://api.whatsapp.com/send?phone=79201566909
1885,Ритуальные услуги,79201936002; 79201536937; 79157347938; 79190609402; 79607188008,"Екатерининская ул., 9, Вышний Волочёк, Вышний Волочёк",https://ritualnye-uslugi-ulitsa-uritskogo.clients.site/,,Вышний Волочёк,,A,40,No,unknown,No,https://t.me/+79157347938,https://vk.com/ritualvv,https://api.whatsapp.com/send?phone=79201936002
1890,Стелла-Мастер,79774838618,"Россия, Тверская область, Вышний Волочёк, улица Сиверсова, Вышний Волочёк",https://stella-master.ru/,,Вышний Волочёк,,B,30,Yes,unknown,No,https://t.me/+79774838618,,
1886,Памятники,79038039993; 79190661143; 79109301392,"ул. Урицкого, 88/56, Вышний Волочёк, Вышний Волочёк",https://nikolai-eremin1953.wixsite.com/,,Вышний Волочёк,,B,27,No,unknown,No,https://t.me/+79038039993,https://vk.com/pamyatniki_vv,
1889,Похоронная служба Вышневолоцкого городского округа,79038057520; 79301768030,"Екатерининская ул., 7, Вышний Волочёк, Вышний Волочёк",,,Вышний Волочёк,,B,25,No,unknown,No,https://t.me/+79038057520,,
